id,name,brewery,category,style,description,abv,ibu
3e2c3c68-314c-4da8-a409-02909da91f60,Atomic Duck,Able Baker Brewing Company,IPA,IPA - American,"Strong hop character backed up by a mild but noticeable malt backbone. Dry hopped with a creative blend of hops designed to yield notes of citrus, tropical fruit, and pine. This beer is named after our mascot and brand ambassador, THE ATOMIC DUCK, and his mythology is the inspiration for this ale.",7.0,88
957312a2-a2a0-4f25-94d4-19bbc5559f0f,Two Hearted Ale,Bell's Brewery,IPA,IPA - American,"Brewed with 100% Centennial hops from the Pacific Northwest and named after the Two Hearted River in Michigan’s Upper Peninsula, our American IPA is bursting with hop aromas ranging from pine to grapefruit from massive hop additions in both the kettle and the fermenter. Perfectly balanced with a malt backbone and combined with the signature fruity aromas of Bell's house yeast, Two Hearted® is remarkably drinkable and well suited for adventures everywhere.",7.0,60
791dfa7d-5d14-4e58-8153-34403247b479,Workhorse IPA,Laurelwood Brewing Co.,IPA,IPA - American,"Workhorse, our biggest seller in the pubs, is an extremely well balanced and super flavorful IPA brewed in the West Coast style. The over-the-top hop aroma comes from the heavy-handed dose of hops in the kettle, hop back and multiple dry hop additions. A slightly sweet finish helps to balance the hop bitterness and creates and ale that is big on flavor yet remains highly drinkable.",6.7,80
1fd0e98b-e116-4abb-98a7-dafb8869c36a,Disco Ninja,Revision Brewing Company,IPA,IPA - New England,"It’s a simple universal fact that ninjas are badass. You know what else is badass? Revision beer. Our buddies at Shoe Tree Brewing kicked around ideas with us to develop this tasty, tantalizing, karate chop in your freaking mouth. Kaleidoscopic nunchuck hits to the dome with Citra®, Galaxy®, Mosaic® and Amarillo®. Stealthily slaying your taste buds, one sip at a time.",7.0,40
c8ae25ae-3541-4e6b-a535-9e298034649c,Return of the Citra Rye,Astronomy Aleworks,IPA,IPA - Rye,A Rye Citra IPA that is dank and delicious.,6.7,70
3ac17f7a-64b9-4319-aa5c-23fb2b8e4abd,HopAtomic,Lovelady Brewing Company,IPA,IPA - Double,"Featuring aromas of tropical fruit (Citra and Cashmere) and a crisp, balanced finish. A Taproom favorite!",8.2,75
4f032045-fca0-4349-9ad8-a8b3c4381cbf,Sublimely Self-Righteous Black IPA,Stone Brewing,IPA,Black IPA,"Stone Sublimely Self-Righteous Black IPA graced our year-round lineup for a few years before its retirement in 2015. Since then, nearly every single day, we receive multiple emails, phone calls and social media comments from diehard fans of this hoppy and dark delicacy, pleading, begging and sometimes demanding us to bring it back. (Seriously, we tried to add them all up and it was easily into the thousands.) Because you can't keep a great beer permanently retired, it's made a few cameo appearances in our Stone Mixed Packs as well as on draft at our Tap Rooms and Bistros over the years. But now it's back nationwide on its own in all its glory. Original recipe. Original artwork.",8.7,90
d59312b6-d13a-46d1-bdbd-18e748816d2e,Thirsty Thurtle,HUDL Brewing Company,Pale Ale,Pale Ale - American,"We are proud to participate in Ales for ALS™ this summer, a program that raises money for ALS research at the ALS Therapy Development Institute (ALS TDI) in Cambridge, MA. Peach, Apricot and Citrus notes lead you into subtle balanced malt bill that provides a bit of biscuit character in the finish, Then we Double Dry Hopped it, using a blend of hops donated by B.T. Loftus Ranches and YCH Hops (HBC 630, Simcoe, Ekuanot, Citra, Mosaic, Ahtanum, Loral and Sabro). The Thirsty Thurtle Pale Ale is Crisp, Clean and Refreshing. Come on in and help us put an end to ALS. We are donating $1 from each pint the ALS TDI.",5.5,25
f7a319cc-6ce4-46e6-9062-984a460a94c1,San Diego Pale Ale .394,AleSmith Brewing Company,Pale Ale,Pale Ale - American,"In early 2014, Tony Gwynn’s team approached AleSmith to create a distinctive beer for the baseball legend. A meeting was called at the Gwynn household, which included a sampling of AleSmith beers to identify Tony’s preferences. He wanted the beer to be “light with a kick” which he elaborated further to mean full of hop character and light in body and color. The result of the Gwynn family’s feedback on test batches rendered a golden pale ale full of American hop flavor and aroma, with a subdued bitterness and a malty sweet finish. AleSmith San Diego Pale Ale .394 pays tribute to the city that Tony loved and the career-high batting average that he achieved in ‘94. Discover what happens when a Hall of Fame perfectionist crafts a beer with a world-class brewery. A portion of the proceeds will go to the Tony and Alicia Gwynn Foundation (TAG).",6.0,13
72079edd-ef8e-44fa-964e-18a613409023,Mexico Surf Trip,Pizza Port Brewing Company,Lager,Lager - Pale,Crisp and refreshing Mexican-style lager.,4.8,10
4582766c-b65b-4310-9906-35e5820027ae,Oskar's Lager,Oskar Blues Brewery,Lager,Lager - Pale,"Oskar’s Lager is the kind of beer Oskar Blues brewers always wanted to drink but couldn’t find regularly on draft in our taprooms or available in cans to take on weekend adventures. Using German lager techniques honed for the Slow Chill Lager Series and a handful of collaborations with other craft breweries, Oskar Blues brewers developed an ultra-crisp, smooth lager with depth of flavor and low ABV, allowing for day-long sessioning.",4.2,N/A
a2207aa9-d36b-4e90-affb-f297f0be8ef1,Apricot Hefeweizen,Wasatch Brewery,Wheat,Hefeweizen,"This smooth and unfiltered fruited hefeweizen has a beautiful apricot nose and a refreshing, slightly tart finish. The bounty of the orchard is now portable.",4.8,9
db2fc1be-a9a4-4e23-9ea7-fe85c473dbf0,Tailwagger Wheat,Big Dog's Brewing Company,Wheat,Hefeweizen,"Authentic Bavarian-style Hefeweizen, possessing strong banana & clove aroma and flavor as a result of special German yeast.",4.9,N/A
8eaf9fd5-8b6a-4b93-ae95-200bc77145ff,I Love NV,Bad Beat Brewing,Lager,Lager - Amber,"Nevada (Ne-va-duh…not Ne-vah-duh) is a special place and only special beer will do it justice! We absolutely were not going to brew a macro industrial lager knockoff and then expect you to be ok with that. We are a craft brewery. We take that seriously. We love Nevada, and we take that seriously too! Nevada is incredibly diverse… in lifestyle, people, weather, and overall culture. That makes crafting a beer to embody it quite difficult. However, at Bad Beat, we do not shy away from a challenge! Thus, we proudly present to you this gorgeous Amber lager. It’s a little hoppy, a little malty, a lot crisp, and a lot more crushable! Exquisitely balanced with biscuit and caramelized sugar malt flavors against floral and citrus hops. Easy, flavorful, and elegantly nuanced. We love Nevada!",5.1,N/A
6983a80e-dfa8-4d40-89e5-836229963da1,Maduro Brown Ale,Cigar City Brewing,Brown Ale,Brown Ale - English,"Among the darkest colored and most complex cigars made in Tampa’s Ybor City is the maduro, made with an overripe wrapper and exhibiting chocolaty and earthy flavors. We draw inspiration from these sophisticated cigars and from Tampa’s cigar-making history with Maduro Brown Ale, a Northern English Brown Ale brewed with flaked oats. Full in body and silky on the palate, Maduro Brown Ale’s chocolate and espresso notes are rounded out by toffee-like qualities and a light, woody hop presence. Enjoy Maduro Brown Ale with chicharrones, ropa vieja, or a fine hand-rolled cigar.",5.5,25
9b62a3c0-d9d8-4717-b610-e35a05b6f5ab,Polygamy Nitro Porter,Wasatch Brewery,Porter,Porter - American,She's on Nitro! Meet the sister-wife of our classic brew. This nitrogenated version is as chocolatey and easy-drinkin' as the original but even softer and creamier. It's ok to love them both.,6.0,30
35ae8bff-7408-4407-9e08-8a8424277bc8,¡Viva La Beaver!,Belching Beaver Brewery,Stout,Stout - Milk,"Viva La Beaver is loaded with notes of creamy peanut butter, cinnamon and coffee. This decadent milk stout is the perfect dessert beer to finish off your meal, and is our highest rated beer, receiving numerous Gold and Silver medals. Sink your teeth into this liquid chocolate treat.",7.5,28
7a04fede-83cc-456a-a919-dddf2c08ab7c,Tank 7,Boulevard Brewing Company,Farmhouse Ale,Farmhouse Ale - Saison,"When our brewers were experimenting with variations on a traditional Belgian-style farmhouse ale, the perfect combination of elements came together in fermenter number seven. You could call it fate, but they called it Tank 7, and so it is. Beginning with a big surge of fruity aromatics and grapefruit-hoppy notes, the flavor of this complex, straw-colored ale tapers off to a peppery, dry finish. With its balance, carbonation, and complex flavor profile, Tank 7 is one of the ultimate food-pairing beers in existence.",8.5,38
b3c5dc40-fdde-4b2d-a54d-1af104dd6de5,Oktoberfestbier,Bad Beat Brewing,Seasonal,Lager - Märzen,Oktoberfestbier is an extremely crushable Marzen style beer brewed with a medley of toasted malts! It goes down super smooth with a crisp finish.,5.6,N/A
9c9ac166-3f89-496d-b31f-fd305d2eaebd,Black O' Lantern Pumpkin Stout,Wasatch Brewery,Seasonal,Pumpkin Beer,"What kind of madman would cross an imperial stout with a pumpkin ale? Our brewers, as it turns out. This rich, chocolatey frankenbrew is dry-spiced and scary good. Boo.",6.7,31
b80ec53c-1efc-48a4-9430-5eb0c77a0964,Plum Fairy (Liquidious Meniscus),The Mad Fermentist,Sour,Sour - Plum,"Kettle Sour Weisse made with Barke Pilz, White Wheat and Flaked Wheat malts. Hopped with Tettnanger and sourced using Lactobacillus Plantarum. Fruited with Plum Puree.",5.8,19
40a827e4-dc13-4202-8b5e-b92bdb7e6b20,Arnold Punker,Lovelady Brewing Company,Sour,Sour - Fruited,Arnold Punker Lipton Tea and Meyer Lemon sour! Tea upfront with a lemon tartness and a hint of sweet on the finish.,6.2,N/A
ddf2d1dc-1310-4df9-84e1-9c735320fba6,Ace Pineapple Cider,Ace Cider,Cider,Cider - Other Fruit,"Inspired by the House Family’s annual visit to the beautiful Hawaiian Islands our Pineapple cider is an ideal drink for tropical hot and humid climates. Our signature drink the Hawaii 5-0 is a mix of Ace Pineapple cider, coconut rum, ice and a garnish of fresh pineapple. This original cider is perfect for a backyard BBQ, or Bacon dishes. First pineapple cider developed in the world",5.0,N/A
6876296f-079e-4288-85b4-85e4c1459224,Ace Apple Cider,Ace Cider,Cider,Cider - Dry,"ACE Apple was first produced June of 1994. ACE Apple has an apple nose and a clean finish. This cider pairs well with all pork dishes, and seafood as it is a refreshing alternative to the high alcohol of wine and heaviness of a beer. Made with 100% all natural apples",5.0,N/A
63edc3f2-b584-4396-8f5c-1ccf687e8781,Silver State Blonde,CraftHaus Brewery,Blonde Ale,Blond Ale - American,Silver State is a name that reflects Nevada’s pioneering spirit and one that we have and forever will wear proudly. Round notes of caramel wash over your pallet and finish clean.,4.8,20
a9ebc362-6d7a-451e-9a0e-851a08509420,Evocation,CraftHaus Brewery,Farmhouse Ale,Farmhouse Ale - Saison,Bright effervescent carbonation brings out the citrus and pepper notes.,6.4,35
27fcf837-6925-4dd8-b539-240344fdb24b,Zitrone,CraftHaus Brewery,Sour,Sour - Gose,"Gold Medal Winner ""Best of Craft Beer Awards"" Effervescent and bright lemon character that finishes with a slight salinity. Traditional style German sour beer that uses 50% malted wheat. Classic toasted coriander and lemon peel for added dimension.",4.0,10
aba2c8e3-6d8b-4f13-b6e7-7f21acf4c6f2,Razzle All Day,CraftHaus Brewery,Sour,Sour - Fruited,"Brewed in the spirit of camaraderie with Great Basin Brewing, this collaboration beer unifies Nevada's craft community. Tart, fresh raspberries bursting with brightness are then mellowed from the addition of smooth lactose. Cheers to Nevada beers!“",8.1,6
7fdabf35-c35f-4e8f-9515-b4c017c93eb7,Resinate IPA,CraftHaus Brewery,IPA,IPA - American,"We generously dry-hopped our IPA with classic combination of Cascade, Centennial and Chinook hops. Pine and grapefruit characters resinate from within.",6.5,58
8bccac2a-2f85-4cf1-b203-1b05281b6041,Dry Heat,CraftHaus Brewery,IPA,IPA - New England,"If you're a local... you know. This juicy, sexy, hazy IPA is double dry hopped with with Citra, Mosaic and El Dorado hops for an excessive hop warning of tropical and citrus aromas.",6.6,N/A
97014c79-dea2-48b0-af4d-e040efe71838,Cuckoo,CraftHaus Brewery,Lager,Lager - Munich Dunkel,"Dunkel, meaning dark in German, pours a deep garnet and topped by a white snow cap. First sip is full of toasted bread from 100% German malts. Then, a clean finish from a lager yeast sourced at one of the oldest breweries in Prague.",5.4,23
9a291084-9fe7-489c-854b-db24b4f947d1,Rock the Haus 6th Anniversary BA Basil Hayden,CraftHaus Brewery,Strong Ale,Strong Ale - American,"Presented to our community in celebration of six triumphant years of quality-driven beers. Sweet aromas of hops, honey and straw along with and a slight cinnamon to peak your interests with this one time only specialty beer. Strong characters of American hops bounce off of oak, molasses and rye spice play off one another with this substantial and satisfying barrel aged beauty.",12.0,N/A
401d7633-2bcf-4e41-9a34-f24a434a4a20,Czech Plz,CraftHaus Brewery,Pilsner,Pilsner - Czech,"Spicy hop aromas activate the and a slight golden haze fills your glass with this snappy and quenching unfiltered Czech pilsner. The beer keeps flowing like Kohl's Fountain until you utter the words, Czech Plz.",5.0,40
d590706d-466d-48b4-8cb2-e04a942e6479,Michelada,CraftHaus Brewery,Blonde Ale,Blond Ale - American,"Tangy with lime juice and Clamato, Worcestershire for a savory bump and Tapitio for spicy kick. Rimmed with that lip smacking Tajin. Pairs amazing with Elote snacking nuts! Use Silver State Blonde or live it up with Zitrone, Sour. Go big time and order it ""Fully Loaded"" with a decadent snack on a stick! Weekly Favor: Tom Yum Miche",4.8,N/A
536aca9c-d293-49ea-bc85-353c905c1504,All the Plumcots,CraftHaus Brewery,Sour,Sour - Fruited,"Like a bite into a juicy stone fruit, this tart ale will leave you confident you have enjoyed All The Plumcots.",4.5,20
e9c828d5-e79c-4362-a2cc-eb179a73679e,Mangonada,CraftHaus Brewery,Sour,Sour - Gose,"Lip smacking, Haus made Mangonada made with Evocation. Mango nectar and tangy Chamoy with a rim of Tajin for a kick. Top it off with a tamarind chili straw. Pair it with Elote warm nuts.",4.0,18
3c79ae60-f52b-45eb-b5d1-fdc8820f216f,Hop Vegas,CraftHaus Brewery,IPA,IPA - American,"Complex layers of hops from Cascade, Centennial, Columbus and Mosaic which bring ripe citrus up front, followed by pine and then a slight tropical finish. A snappy and dry malt body combined with bold hops come to crush it with this West Coast IPA because no one hops it like Hop Vegas!",7.0,78
69facdfa-5b22-4936-9cf4-0fe38993c8f0,Giggle Juice,CraftHaus Brewery,IPA,IPA - Double,"We can hear you giggling right now with glee! Giggle Juice hits you like an Unflitered, Double IPA should with juicy citrus and tropical fruit notes. We gave our DIPA heavy doses of Citra, Mosaic and CTZ hops.",10.2,101
3c2d0021-1e75-431d-84fd-511a2ba64746,Belgard,CraftHaus Brewery,Stout,Stout - Coffee,A luscious dark chocolate malt backbone married with locally roasted cold brew coffee from Vesta coffee Roasters.,5.2,30
2a93024c-1a69-4a5e-a5ea-bbeb6968baa7,HEXX Chocolate Tanzanian Cream Ale,HUDL Brewing Company,Cream Ale,Cream Ale,"In Collaboration with the HEXX Chocolate Company, we have been able to create something very special. A crisp, clean and refreshing Cream Ale that smells of wonderful HEXX 47% Milk Chocolate sourced from the village of Mbingu, Near Ifakara, Tanzania. Then, your sense of taste is melted with an amazing 70% Dark Chocolate, from the same Tanzania Cacoa Bean.",6.0,5
76102fdb-aa82-45f5-b12c-8ef500df7190,Vanilla Oak Barrel Aged On Chocolate,HUDL Brewing Company,Cream Ale,Cream Ale,"A crisp, clean and refreshing Cream Ale that was aged in whiskey barrels. Then we added a wonderful HEXX 47% Milk Chocolate and 70% Dark Chocolate, from the same Tanzania Cacoa Bean. Enjoy.",6.5,11
4f0df79b-80be-43f5-bda2-bbe789b472d6,Arts District IPA,HUDL Brewing Company,IPA,IPA - American,We start you with a sweet Carmel nose. Clean and crisp with a creative range of hop character to shine through.,7.2,48
2dbcbf61-8469-4de6-afb1-0a14c6958de3,WATERMELON SOUR,HUDL Brewing Company,Sour,Sour - Fruited,"Coming in at 4.7% and 3.0PH...SIMPLY REFRESHING The watermelon is subtle keeping this hand crafted sour beer fresh, crisp and clean. enjoy",4.7,5
0af4aca0-91f2-4da5-98b7-ded2e918cdab,Orange/Pomegranate Sour,HUDL Brewing Company,Sour,Sour - Fruited,Weighing in at 4.7% and 3.0PH...The Orange comes thru with that hint of Pomegranate at the fini,4.7,5
5d0d1ff8-49f5-4014-aeb5-341ebfb75214,Anodized Amber Ale Aged On Oak,HUDL Brewing Company,Red Ale,Red Ale - American,"This well crafted American Amber Ale, showcases a complex grain bill, built around the highest quality crystal malts. Aged on Oak",5.8,35
17aac130-a63b-424d-9b62-a3c21571e3fe,JUST DO WIT,HUDL Brewing Company,Wheat,Witbier,"JUST DO WIT is a traditional Belgian Witbeir Ale, brewed by just a few of the many amazing women in our industry. We are proud to be a small part of celabrating women in the craft brewing world. 50/50 blend of unmalted Wheat and 2row and the bold Jade Pacific Hop will stimulate your soul. A spectacularly refreshing and crisp ale with hints of citrus, coriander and black pepper. The perfect way to close out the summer.",4.8,22
1e2076b2-4c7f-4677-9351-0209aa2bb7a0,SHAGGY ASSASSIN - ROTATIONAL IPA HAZY,HUDL Brewing Company,IPA,IPA - American,"We veered off course a little with our first rotational release of the Shaggy Assassin. We started with a typical New England IPA grain build...Using Citra, Mosaic, Mandarina Bavaria and Zythos hops. We then went full on west coast with the Cal Ale yeast. The result is a pretty cool kinda hazy IPA....",6.8,44
454318b2-a369-4e69-ac8c-4b7c0d14ef65,Shaggy Assassin Guava IPA,HUDL Brewing Company,IPA,IPA - American,"We would like to introduce our Shaggy Assassin ROTATIONAL IPA SERIES. We will release one beer every 3 months in cans and draft. 1st is our Unfiltered Guava IPA, the nose is a little woody with hints of grapfriut, the Munich Malt creates the perfect platform for the subtleness of the Guava",5.7,41
ea4973be-6688-4aaa-878d-4d4c2948164f,High Hatter Hefe On Pineapple,HUDL Brewing Company,Wheat,Hefeweizen,"A traditional German Hefeweizen, but instead you are transported to the islands of Hawaii. We dropped 10 lbs/barrel of pineapple puree, resulting in a wonderful nose with a perfect amount of sweetness from the pineapple.",5.5,12
d63c735c-61e3-4134-b220-323ef3e0dbc6,SCORCHED MEADOWS - HAZY,HUDL Brewing Company,IPA,IPA - New England,"A Las Vegas Style Hazy IPA with a floral and citrus nose with a solid backbone that finishes crisp and a little drier (Vegas Style). Las Vegas translates as ""The Meadows""",6.3,44
2b460e21-1a6e-4232-8bb4-8af93c5cfeed,115° Imperial Stout,HUDL Brewing Company,Stout,Stout - Imperial,"Beautiful dark chocolate and light roasted will be front and center. Then the complexity of the grain bill will come thru and completely balance the chocolate and roast, leaving you questioning the ABV due to the perfect balance. OG 1.114 FG 1.020",12.3,43
d3835177-7e5f-4223-adad-cedb2d196005,NAC NAC - Kumquat,HUDL Brewing Company,IPA,IPA - American,"We put NAC NAC on Kumquats...The nose is a little more bright/citris and the contrast juice and the rhine, allow for a softer finish. Enjoy. A top of the podium West Coast IPA. Citrus, Melon and Pine dominate the nose. Clean and crisp with the supporting malt building a creative range of hop character to shine through. The NAC NAC is a time travel back to the 1990's when San Diego created the west coast IPA and Jeremy McGrath was dominated Supercross Racing. He changed the sport forever and San Diego changed beer forever. Thank You!",7.2,N/A
16289017-205b-428d-9aef-24885aa66a7b,The Patio,HUDL Brewing Company,Fruit,Shandy,Tangerine is what you get in the nose and the taste. 100% crushable in the heat of las Vegas. So come on down the patio and enjoy this collaboration with Nevada Brew Works,4.7,10
ae87aef2-78cf-407f-8199-f3338dd0eab7,The Mosquito,HUDL Brewing Company,Lager,Lager - American,"This lager is smooth, delicate, crisp and thirst quenching. It is brewed with the highest quality malts and perfect amount of flaked maize, along with a true lager yeast from Mexico city. We respectfully celebrate the Mexican culture and heritage.",4.6,20
47944c92-07e6-469b-baec-92a927b10aa5,Mosquito Bite,HUDL Brewing Company,Lager,Lager - American,"We took our perfectly brewed Mexican lager, and asked ourselves…what could put this beer over the top? Serrano’s! We took fresh Serrano Peppers and put them in a brick oven at 600°F and scorched them thru and thru. We then put these gems in our aging tank and let time take its course. The aroma is bursting of fresh roasted Serrano Peppers, and once you take a sip, the wonderful flavor of the Serrano balances well with this crisp and refreshing lager.",4.6,10
5d49be70-3a14-4122-be4c-cc75e41c0926,VANILLA OAK,HUDL Brewing Company,Cream Ale,Cream Ale,"Not your normal cream ale, vanilla and the perfect amount of oak character will quench your thirst.",6.0,11
9c50fdfa-dc29-45b4-9750-b0b56d1b2887,Vanilla Oak On NITRO,HUDL Brewing Company,Cream Ale,Cream Ale,"Not your normal cream ale, vanilla and the perfect amount of oak character will quench your thirst.",6.0,11
5973a4dc-1a22-4fce-8762-c96bda84cdcd,WRATHFUL ROSE,HUDL Brewing Company,Fruit,Fruit,30 lbs of Hibiscus at whirlpool gives this unique ale its color. We add honey and Red Berries to complete the flavor profile.,5.3,N/A
5cfa5bcd-3a59-406e-b029-22958e13cba9,Super Mini,HUDL Brewing Company,Lager,Lager - American,"Crisp and Clean and light bodied, Single Hooped with Mosaic, gives it a twist that is refreshing and slightly off center.",4.2,14
3493015c-9850-4dba-99e4-0abcdd744836,SALTY SWABBER,HUDL Brewing Company,IPA,IPA - Double,The Salty Swabber will punch you in the nose with amazing American Hops. There is the perfect amount of body and backbone to balance it quite nicely. leaving you with a slightly sweet warm finish.,9.4,79
5b838cde-cd14-47a1-81b9-8eb8d99a0adc,Big Foozy,HUDL Brewing Company,IPA,IPA - Triple,"Every true IPA lovers dream! We brew this west coast style version with nothing but love! All American grains and hops were used to showcase the best of what we do in a 13.1% abv and 120 IBUs beer. Overloading your sense of smell with Apricot, Dates and ripe Plums. Then the long boil Caramelize the beer to bring out the complexity of our grain bill and a sweet character of brown sugar and honey. Complimenting all our hop additions in boil and whirlpool…then we double dry hopped it. Float like a butterfly and sting like a bee. Enjoy!",13.1,120
526bdb54-082e-41db-ba83-fd5284e46295,GP,HUDL Brewing Company,Barleywine,Barleywine - American,"An American style Barley Wine, showcases one of the best dual purpose hops...Cashmere...Molasses, stone fruit and dark raisins leads you into tastes of biscuit and toffee. The 120 minute boil creates the absolute perfect amount of Caramelization which encapsulates the entire experience, both the mouth feel and color.",10.0,82
7e940d6e-fff8-4cbd-abc8-2f87168f3929,Weird-as-Funk,HUDL Brewing Company,Brett,Brett - American,A Brett-Pedio blend from our Wine Barrel Project. This beer is inspired to compliment the light and subtle characteristics of brettanomyces and pediococcus. The bacteria were added and had a secondary fermentation for 2 months in a medium oak wine barrel. This is a one of a kind treat.,5.6,7
bdc3bbef-e7f2-474a-9a87-eac7299e3d9c,Ruby Soho,Mojave Brewing Company,Cider,Cider - Other Fruit,Grapefruit Cider,9.0,N/A
db93bf94-dad1-4e9c-98c8-b0cfe9bd15b4,38 Special,Big Dog's Brewing Company,Red Ale,Red Ale - Other,"A blend of our Gold Medal winning brews! Peace, Love, & Hoppiness Pale Ale and Red Hydrant Ale.",5.6,N/A
c75ab31c-6970-4368-8722-15eb0cebc088,44 Magnum,Big Dog's Brewing Company,Red Ale,Red Ale - Other,Dirty Dog/Red Hydrant Blend,6.4,N/A
3c4b4b19-fc3e-4d7e-bf3c-44e0a6f9ed9d,50 Caliber,Big Dog's Brewing Company,Brown Ale,Brown Ale - Other,Delicious blend of our Underbite IPA and Red Hydrant Brown Ale.,7.5,N/A
d63d87a8-8930-47fb-b2c5-00b49eefde2f,Black Lab Stout,Big Dog's Brewing Company,Stout,Stout - American,"Delicious and satisfying anytime of year! A rich, dark ale brewed with nine different malts along with roasted barley, with hints of coffee and cocoa.",5.9,N/A
2896ec9b-6ce0-4512-83c5-b1d02e5b3daf,Dirty Dog IPA,Big Dog's Brewing Company,IPA,IPA - American,"Dirty Dog IPA is a delicious west coast-style IPA, bursting with Northwest hop flavor and aroma. With just a hint of toasty malt in the finish, you’re sure to be reaching for another sip of this very tasty American IPA.",7.1,70
84c41be4-b1e3-4b38-9bc9-2074b32af283,Las Vegas Craft Lager,Big Dog's Brewing Company,Lager,Lager - Pale,"Las Vegas Craft Lager is a classic American-style lager. Lightly hopped, crisp, and clean; this beer is designed for a town that is always on the go.",5.0,N/A
394e9171-8e79-47e7-b7ae-d4f0d8789c04,Leglifter Light,Big Dog's Brewing Company,Lager,Lager - Light,"Light in color and mild in flavor, this beer is a refreshing alternative to American-style light lagers. A perfect introduction to handcrafted beers!",3.9,N/A
