id,name,brewery,category,style,description,abv,ibu
1c80453e-9fda-4a76-89cb-5e24a10ec98b,Ententanz Oktoberfest,Able Baker Brewing Company,Seasonal,Lager - Festbier,"Sometimes a story just tells itself. In the late 1950's Swiss accordion player Werner Thomas penned a tune called ""Der Ententanz"" (The Duck Dance) because, in addition to accordion playing, he also tended flocks of ducks and geese. Thomas began playing the composition in local hotels and restaurants where guests created a dance to the bouncy tune that, they believed, mimicked the movements of a duck. The dance eventually grew to include beak, wing, and tail motions. By the late 70's, the tune had become a popular drinking song at Oktoberfest and Germans had given the song a new name, ""Vogerltanz"" (Little Bird Dance). The dance made its way to the United States in 1981 via an Oktoberfest celebration held in Tulsa, Oklahoma. Founding members of that Oktoberfest celebration wanted to demonstrate their love of the song through a dance performed in costume, but no duck costumes were available. Luckily, a local TV Station had a chicken costume to donate and the ""Chicken Dance"" was born (this is a true story). Our Oktoberfest style beer is meant to mimic the fun and enthusiasm experienced by those who enjoy this, now, ubiquitous Oktoberfest dance. Classic ingredients like Vienna and Munich malts, Hallertau hops, and German Lager yeast pay tribute to Old-World elements that will have you ""flapping your wings"" for tradition, while the 6% ABV provides you with just enough liquid courage to ""shake your tailfeather"" and celebrate the new. Crisp, clean, and malt driven with a beautifully dry finish, this copper colored Festbier is our ""Prost!"" to you.",6.0,14
2e5353be-e564-457b-904a-8cee911ce5ca,Excited State,Able Baker Brewing Company,Pilsner,Pilsner - German,"In atomic terminology, when an atom or nucleus possesses more than its normal energy it enters into an ""excited state"". That's both the name of our German style Pilsner as well as the condition you'll achieve after tasting it. We start with an elegantly traditional base and add just a touch of Vienna Malt (for a bit more toasted malt character) then hop this crisp, easy drinking lager with Hallertau Mittelfruh and Saphir for a distinctive yet smooth flavor and bitterness. When excited state atoms decay the excess energy is released in the form of gamma rays and fluorescence. While we promise that you won't ""hulk out"" after drinking this brew, you may choose to sip and bask in the ""glow"" of the excess energy this beer possesses.",5.0,30
6833fcf7-dd6f-43b0-a541-d236a15690df,Grim Reaver,7Five Brewing Co,Stout,Stout - Irish Dry,"Light, fizzy stout, slightly sweet, malty",7.5,N/A
6d746428-cf04-483e-9253-098a7fff03b8,Dawn Breaker,7Five Brewing Co,Lager,Lager - American,"They say half of success is just showing up. And as the underdog, we know the other half is showing up before everyone else does. Dawn Breaker is your cheerleader, championing you for earning your spot, every day. Early mornings, and late nights.",4.8,20
e6dae4a5-6746-4e75-a91b-fffb3b1ba8c9,Shiver Giver,7Five Brewing Co,IPA,IPA - American,"It’s not something you can see. It’s only something you can feel. A sensation that sends tingles through your body, and lets you know you’ve just witnessed something unique. Something incredible. It’s the culmination of everything you’ve worked for.",6.8,55
2047c976-48ee-4d47-bd0f-d0f87c10f370,Training Day,7Five Brewing Co,Golden Ale,Golden Ale,"You can’t finish unless you start. And once you start, well, you’re halfway home. Training Day is your jumping off point. It’s your introduction to the world you’ll one day claim. It’s where your journey begins. ",5.8,35
f9d28b5e-04da-4d0d-ae6c-41cfcf2939cc,5 Pepper Porter,Able Baker Brewing Company,Porter,Porter - American,"From a brewery known for bold flavors this is probably our most ambitiously flavored beer. This American Porter is brewed with fresh toasted coconut and then dry hopped with a 5 pepper combination that includes jalapenos and habaneros. A deeply layered beer that goes from an upfront coconut nose to chocolate/caramel sweetness, and finishes with habanero heat.",6.5,40
45b0f655-875f-40d3-9a01-8a12e1f707f4,Gamma Ray Burst,Able Baker Brewing Company,Belgian,Belgian - Tripel,"The intersection of astronomy and atomic energy: Gamma Ray Burst. In the 1960s the USA launched top-secret satellites to detect gamma radiation from Soviet warhead testing. Scientists recorded numerous gamma bursts but they emanated from an extraterrestrial origin! Declassified in the 1970s, astronomers discovered the bursts were the result of supernovae and black hole collisions. This Tripel won't explode in your glass but it will ""burst"" with traditional Belgian characteristics you love: fruity esters, spicy phenols, and noticeable alcohol. This brew might take you to new worlds but won't leave you stranded because its recipe is ""based on real science""!",10.0,N/A
f337b45a-116d-47a7-8810-d1c3e6d5062a,Triple Jam,Blake's Hard Cider Co.,Cider,Cider - Other Fruit,"Inspired by the juicy berries we grow on our farm each summer, Triple Jam is the perfect balance of ripe sweetness with bold fruit aromatics. Bursting with strawberries, blackberries, and raspberries, this semi-sweet captivates the nuance of our farm, in each and every taste.",6.5,N/A
01bcbe70-840d-4517-a7e9-4a701a513bc0,Chris Kael's Root Beer'd,Able Baker Brewing Company,Root Beer,Root Beer,"Continuing our collaborative efforts with our favorite rock star, Chris Kael, we're pleased to present our first non-alcoholic offering....Chris Kael's Root Beer'd. This sweet, spicy, root beer, is dosed with an extra amount of vanilla bean and then rested on oak to add an extra layer of rich decadence. Available on it's on, in Crowlers to go, or as part of our super-sized root beer floats this one's sure to get to the root of your thirst.",0.0,N/A
